{
  "audience": {
    "duration": 60,
    "language": "en",
    "number_of_players": {
      "players_max": 6,
      "players_min": 3
    }
  },
  "credentials": {
    "license": "CC BY-NC-SA 4.0",
    "publication_year": 1900
  },
  "description": {
    "summary": "Grâce à ce jeu de carte fabuleusement illustré et immoralement conçu, vous allez, si tant est que vous soyez majeur, partager le sort de l’une des personnalités qui vécue en 1492, au côté du Pape Alexandre VI, dans la Rome des Borgia."
  },
  "fabrication": {
    "fab_time": 120
  },
  "source": {
    "url": "http://leschiensdelenfer.org/editions-chiens-de-lenfer/borgia-le-jeu-malsain/"
  },
  "timestamp_add": "10/10/2015 14:52:35",
  "title": "Borgia, le jeu malsain",
  "content_type": "game"
}
